<?xml version="1.0" encoding="UTF-8"?>
<!--
 - Copyright 1999-2012 Alibaba Group.
 -  
 - Licensed under the Apache License, Version 2.0 (the "License");
 - you may not use this file except in compliance with the License.
 - You may obtain a copy of the License at
 -  
 -      http://www.apache.org/licenses/LICENSE-2.0
 -  
 - Unless required by applicable law or agreed to in writing, software
 - distributed under the License is distributed on an "AS IS" BASIS,
 - WITHOUT WARRANTIES OR CONDITIONS OF ANY KIND, either express or implied.
 - See the License for the specific language governing permissions and
 - limitations under the License.
-->
<!DOCTYPE cobar:schema SYSTEM "schema.dtd">
<cobar:schema xmlns:cobar="http://cobar.alibaba.com/">

  <!-- schema定义 -->
  <schema name="dbtest" dataNode="dnTest1">
    <table name="tb2" dataNode="dnTest2,dnTest3" rule="rule1" />
  </schema>

  <!-- 数据节点定义，数据节点由数据源和其他一些参数组织而成。 -->
  <dataNode name="dnTest1">
    <property name="dataSource">
      <dataSourceRef>dsTest[0]</dataSourceRef>
    </property>
  </dataNode>
  <dataNode name="dnTest2">
    <property name="dataSource">
      <dataSourceRef>dsTest[1]</dataSourceRef>
    </property>
  </dataNode>
  <dataNode name="dnTest3">
    <property name="dataSource">
      <dataSourceRef>dsTest[2]</dataSourceRef>
    </property>
  </dataNode>

  <!-- 数据源定义，数据源是一个具体的后端数据连接的表示。 -->
  <dataSource name="dsTest" type="mysql">
    <property name="location">
      <location>10.20.153.177:3316/offer1</location>
      <location>10.20.153.177:3316/offer1</location>
      <location>10.20.153.177:3316/offer1</location>
    </property>
    <property name="user">offer</property>
    <property name="password">offer</property>
    <property name="sqlMode">STRICT_TRANS_TABLES</property>
  </dataSource>

</cobar:schema>
